MsgID,MsgBody
'kwurzks',date level description cmstatus us_diplexer_mode_change init sync time synchronization failure fail acquire symbol cmstatus ds_diplexer_mode_change_ignored cmstatus ds_diplexer_mode_change_ignored cmstatus us_diplexer_mode_change cmstatus us_diplexer_mode_change start unicast maintenance range response receive unicast maintenance range attempt response retry consecutive timeouts try range upstream channel range response receive start unicast maintenance range response receive start unicast maintenance range response receive start unicast maintenance range response receive start unicast maintenance range response receive start unicast maintenance range response receive start unicast maintenance range response receive start unicast maintenance range response receive start unicast maintenance range response receive start unicast maintenance range response receive cmstatus us_diplexer_mode_change init sync time synchronization failure fail acquire symbol cmstatus ds_diplexer_mode_change_ignored cmstatus ds_diplexer_mode_change_ignored cmstatus us_diplexer_mode_change cmstatus us_diplexer_mode_change cmstatus us_diplexer_mode_change init sync time synchronization failure fail acquire symbol cmstatus ds_diplexer_mode_change_ignored cmstatus ds_diplexer_mode_change_ignored cmstatus us_diplexer_mode_change honor mdd ip provision mode dhcp fail request send cmstatus ds_diplexer_mode_change_ignored cmstatus ds_diplexer_mode_change_ignored cmstatus us_diplexer_mode_change honor mdd ip provision mode dhcp warn field invalid response cmstatus us_diplexer_mode_change unrecognized ds profile assignment change ds chan id previous profile new profile mismatch calculate value compare ccap provide range response receive ccap command power excess db value correspond top dynamic range window violation range response receive ccap command power exceed value correspond top dynamic range window violation successful lan webgui login pm successful lan webgui login pm ccap command power exceed value correspond top dynamic range window violation ccap command power exceed value correspond top dynamic range window violation ccap command power exceed value correspond top dynamic range window violation ccap command power exceed value correspond top dynamic range window violation ccap command power exceed value correspond top dynamic range window violation start unicast maintenance range response receive ccap command power exceed value correspond top dynamic range window violation ccap command power exceed value correspond top dynamic range window violation start unicast maintenance range response receive ccap command power exceed value correspond top dynamic range window violation ccap command power exceed value correspond top dynamic range window violation ccap command power exceed value correspond top dynamic range window violation ccap command power exceed value correspond top dynamic range window violation ccap command power exceed value correspond top dynamic range window violation ccap command power exceed value correspond top dynamic range window violation ccap command power exceed value correspond top dynamic range window violation start unicast maintenance range response receive ccap command power exceed value correspond top dynamic range window violation ccap command power exceed value correspond top dynamic range window violation ccap command power exceed value correspond top dynamic range window violation start unicast maintenance range response receive ccap command power exceed value correspond top dynamic range window violation ccap command power exceed value correspond top dynamic range window violation ccap command power exceed value correspond top dynamic range window violation ccap command power exceed value correspond top dynamic range window violation start unicast maintenance range response receive ccap command power exceed value correspond top dynamic range window violation
'kwusa1f',upstream channel id lock status us channel type frequency width power lock hz dbmv lock hz dbmv lock hz dbmv lock hz dbmv
'kwuszrz',downstream channel id lock status modulation frequency power correct uncorrectables lock hz dbmv db lock hz dbmv db lock hz dbmv db lock hz dbmv db lock hz dbmv db lock hz dbmv db lock hz dbmv db lock hz dbmv db lock hz dbmv db lock hz dbmv db lock hz dbmv db lock hz dbmv db lock hz dbmv db lock hz dbmv db lock hz dbmv db lock hz dbmv db lock hz dbmv db lock hz dbmv db lock hz dbmv db lock hz dbmv db lock hz dbmv db lock hz dbmv db lock hz dbmv db lock hz dbmv db lock hz dbmv db lock hz dbmv db lock hz dbmv db lock hz dbmv db lock hz dbmv db lock hz dbmv db lock hz dbmv db lock hz dbmv db lock ofdm plc hz dbmv db
'kwutaqg',post raw data minus mac address signal level seem ok think one slightly recommendation see timeout errors
'kwuuovx',seem like throttle probably due node overload hence reason contact physically able support speed anymore throttle code anywhere maybe change another tier throttle exist
'kwuv717',happen comcast cable cox recently cox app suddenly appear samsung tv idea care much tv tell use much storage apparently cure dump apps like dump cox app use never choose know rear head get rid go screw something else
'kwuw8a1',see errors upstream errors make sense context could post screenshot signal level imgur work better copy paste also date slow speed look majority
'kwv33wz',see qam upstream channel isnt weird usually upstream ofdma channel go along could hide data mention go splitters direct connection demarc ground outside room modem suggest technician troubleshoot last time line street house replace
'kwvthly',refer slowdown node overload throttle thats im talk im talk connection due overload node contact tell due high usage go reduce speed reduce usage specific number reduce usage still reduce speed anyway verify run speed test max speed would get definitely cap specific number much lower plan contact back say decision final speed would stay reduce automatically return full speed later maybe throttle isnt right word maybe theres different word term describe isp rather automate way code system temporarily slow connection due high data usage maybe something like temporary force downgrade end user point view slow connection due usage specific amount data seem like throttle connection throttle mean happen automatically maybe incrementally code systems yeah see could call throttle
'kwwb2ym',need go cancellation process every year keep
'kwwbw35',box need swap something fail schedule tech stop cox store
'kwwc5c5',input dog assume replace
'kwwdkk4',absolutely free equipment wont free dont right
'kwwdngc',damn guess kinda forget equipment lol hell yeah
'kwwdsj0',boomer
'kwwenw0',multiple ways option easiest go cox store exchange equipment new one option call support keep press get agent option use cox app use smart help option give things troubleshoot skip schedule appointment option text support chat agent remember may fee may apply non cox equipment cable need replace involve avoid fee able replace wire equipment get cox complete care service offer sometimes tech let slide together hope help
'kwweomu',plan seem operate everyday low price plan ive never offer discount plan seem offer deal
'kwwfbmk',agree somewhat isnt rant post post help op get tech appointment leave cox internet month ago intermittent service arent bad company depend area factor yes tv free antenna problem get antenna also cox fault people charge watch tv mostly tv company like nbc abc disney fox etc cable company pay license channel pay company watch tv theres answer rant post help op hope help
'kwwjdd5',box may mess long pay cable tv cox need internet box update box modems build
'kwwpvkf',thats issue see time time require box swap every time box swap free charge go store bring old box youll get another one happen fail instal would incur charge tech visit also need data service update box
'kwwqk5o',thank info appreciate
'kwwwzkx',contract cox change plan whenever like
'kwwx3b1',know say lady say able less
'kwwxeg9',misunderstand let know anything help
'kwwxn21',legit pay sales reps upgrade customers internet speed offer new customer price sure get information double check
'kwx9dye',comment trawl post days later question cox shill sales procure revenue
'kwxo9z5',thank seem information correct
'kwybw1l',use trawl incorrectly go insult class
'kwyskk9',https https sound like need use cox internet contur box specifically relate cox look article cox website
'kwyyzv6',replacement idea house years old wouldnt surprise og go demarc connection attic straight ft wall outlet another connection small ft run modem call tech word doesnt dismiss concern
'kwyzqbu',refer https ive experience twice around downstream also seem drop bite happen vs
'kx031jm',data point anyone every time call number hang ive try time far go whole queue say next caller hold music stop hang im gon na try hour piss
'kx06lpw',get hang call get answer think may lol
'kx070ny',feedback ive call back quite time thing im gon na wait try time today infurating
'kx12pkf',particular way check modem use docsis versus model support docsis also support fastest possible speed use older docsis standard wonder issue similar customer hop go hop similar ops hop
'kx14liy',number reddit call reactivate competitor year say get percent email even tho didnt get unlimited happy
'kx1512e',call number get disconnect couple time get someone mention know exactly talk never get email bluff able activate old account months ago get unlimited data happy thank everyone post info
'kx16ij8',luck speed
'kx1j18p',awesome cable business many years really enjoy repair part
'kx1j57t',much
'kx1ledn',light blink internet cox extremely unhelpful
'kx1wjh4',ccc wont allow change ip one change ip try power modem day see lease expire see dhcp server give different ip also try vpn
'kx1x2rg',vpns arent mass blacklist well residential pain ass
'kx20okv',huh primarily single double person home need internet fast point time would pay service
'kx260us',chat support try ropeadope take complaint straight fcc fraudulent business tactics also reach executive escalations corporate number file complaint
'kx2iw11',way change ip swap modem router new ones assume use equipment router see macaddress clone stand alone router
'kx2kjdz',signal line change anything recently
'kx2peci',type issue devices effect websites second disconnection may able trigger ip address change write address prior see change
'kx2utc7',know issue research correct cox isnt try prevent record arent exactly sure happen last hear idea think may figure cause problem may
'kx3tf4z',ip address try change ccc basically manage support home tech problem work fix want change lan ip address computer device would help sound like want change wan ip assign router doubt would help wan ip unless show connection issue kind modem kind router three ways try get new ip almost anybody power modem router wait minutes power back longer wait likely work sometimes need old ip release new one assign router support mac address clone allow manually enter mac address use make router appear different device change mac address something else power modem router wait minutes power back new ip assign buy new router https
'kx3v7c7',figure soon get fubotv watch padres open day game get home work
'kx44kes',assume panoramic gateway change wan ip isnt practical remote support point view anyone know remove modem provision lock wall garden reprovisioning change ip ccc
'kx482n6',frustrate able record game manage catch back half game come
'kx4oj3g',thing happen cox last month fraud charge call well fargo freeze account saw pending charge cox tell valid charge charge never go get pay new account number freeze account change new number get bill cox return payment fee call say would refund find month bill fee similar issue credit fraud june last year philippines virginia one state maximum fee talk customer support today say would resubmit request exception doubt get approve call well fargo give case number good luck
'kx55nmy',do lab research center wont see wild anytime remotely soon something like would initially implement internet backbone providers increase throughput exist fiber comparison home internet speed make great headline would also allow cox providers increase throughput nod would prevent run additional line bandwidth use go
'kx55pd9',post rant weekly rant stick thank
'kx5wrth',internet tv cell phone providers soft credit check refuse u pay deposit certain service upfront
'kx62st6',people want new ips band websites power modem hours change
'kx66m1m',qualify cox connect assist month include modem
'kx66tsm',place use cox internet address go sit change gmail account much easier
'kx674ao',one do research center control environment need speed go launch missiles
'kx6qjcm',problems record game due copyright issue rebodcasting right impose upon football baseball hockey soccer etc
'kx76ud0',device network wifi wire cloudfare rate limit lot websites straight ban like kinokuniya
'kx76z21',might shit n giggle
'kx771u1',router feature try doesnt work turn
'kx77l3g',wan ip want change ill give shoot
'kx7i9hn',watch inside house connect home pick signal cox email etc use ipad pick home
'kx7j42h',demand cox content require cox internet work u try access apps via cox contour box yes u need internet work
'kx7pyos',extra course
'kx7yars',use home broadcast able tag ei account stream fee use roku device
'kx81u1s',web interface yahoo servers run use thunderbird email usual
'kx3tf4z',ip address try change ccc basically manage support home tech problem work fix want change lan ip address computer device would help sound like want change wan ip assign router doubt would help wan ip unless show connection issue kind modem kind router three ways try get new ip almost anybody power modem router wait minutes power back longer wait likely work sometimes need old ip release new one assign router support mac address clone allow manually enter mac address use make router appear different device change mac address something else power modem router wait minutes power back new ip assign buy new router https
'kx8otsw',years buy modems amazon use cox internet house never work cox panorama modems slow work
'kx8vek5',post rant weekly rant stick thank
'kx8vwks',get switch account yahoo smtp still work address wonder theyre gunna take mail servers offline
'kx94xt4',sorry ei account
'kx9f84m',cox mail yahoo outlook https solve outlook yahoo issue
'kx9iezt',assume mean cloudflare find anything cloud fare remember troubleshoot customer similar experience ethernet hub connect directly router issue ethernet hub cause red flag ip address look sketch firewall block certain apps ethernet hub try remove network service use cloudflare vpn web security etc seem like cloudflare issue reset ip may resolve solution potentially happen contact already say good idea find informative link within well https last thing recommend turn type usually reason cox rental cox rental disconnect modem minute reconnecting resolve issue modem swap cost either look forums specific setup call manufacturer keep mind cox complete care may cover ip change also day contract try call tech support normal business hours get opinion higher chance talk someone high churn outsource employee help ask transfer tier season well round get damn thing sure worth resolve issue could dispute chargers hope help good luck
'kx9kysz',see call soft credit check lower credit score remain inquiry years way potentially decrease credit score leave company unpaid balance pros think finance equipment vs pay upfront potential deposit amount mistake sales reps bill reps cox es bill system make easier walk away unresolved bill issue credit involve especially cell phone lease manufacturer
'kx9l9gi',watch sport include baseball years care admit always get home team broadcast
'kx9w08p',end buy new one target work
'kx9zs6n',email transition yahoo longer tie cox cancel cox time keep email
'kxa07tg',suck know better
'kxa6fvj',perfectly honest really big baseball fan playoffs world series may want check subreddits ask question pertain particular app best advice ive watch sport tv years im base answer
'kxa8mr6',long transition go take receive anything yet
'kxaavfo',buy ei extra innings cox activate account stream away feed roku stream device home feed available cox service
'kxab7la',prefer service thru cable simplicity mlb tv much offer also allow listen radio feed sync video broadcast give view options
'kxakwml',im confuse
'kxalz8v',sure one member household migrate rest us yet
'kxamiwx',keep email thing really compel us stay cox years claim improve customer experience laughable best shall see future hold
'kxaomlt',tell year chill l email
'kxaskrt',kind modem fiber coax coax coax cable screw back modem power cord include modem
'kxb0q8f',dump whole concept use isp email years ago due pita move new area country go motion notifiying everyone email change get gmail account make sense decent email service move pay google account worth domain one email account extra security storage
'kxb8gzt',call cox update add modem network
'kxb8w27',trasitions start april email still remain difference yahoo mail servers handle incoming outgo mail email subscribers recieving info soon make transition cox give subscribers year complete need step make transition subscriber within year downfall lose old email hard cut date april
'kxba217',service base coax fiber would get look signal level modem post dbmv snr level downstream channel simple things inspect cable come home take unused splitters check tight connectors get modem signal level would first thing check post
'kxbh7ua',must call cox register new modem
'kxbi57l',game download might even internet speed part equation write speed drive effect download server pull file effect speed regular speed test place like speedsmart fast show get full gig
'kxbivs7',last run show
'kxbj1sz',check im home speak cox tell equipment need upgrade dont understand tell months ago correct one plan
'kxbkjlq',get say situation describe would rare pull gig multiple devices unless download massive file game time possible yes likely
'kxbl7f2',panoramic modem modem need detail
'kxblu6h',thier pinhole reset button back modem get paper clip press second release modem go back default settings wifi name password bottom sticker modem still doesnt broadcast wifi equiptment failure take nearest cox solutions store swap
'kxbmkay',cox completely business crook company try charge u dispute charge else fail tell credit debit card company reissue u card new number u allow bank debit ask bank block future debit call state puc well report force listen propaganda diatribe want cancel century link stall call state puc get cancel work surprise u digital antenna get load channel free internet verizon mobile offer home internet usually better price anyway
'kxbpcin',wan na say theres set slow download speed make sure disable say long pc gigabit network port directly connect modem cat cable see fairly consistent cable signal level decent
'kxbpgvf',decent gb plan
'kxbqpj4',suggest arris modem stand alone modem see speed directly connect slow look signal level https fastest speed around look downstream ofdm channel two show snr none uncorrectables finally problem steam keep mind lot factor come play download something server things like server upload bandwidth congestion computer server new may help probably wont hurt router lot depend need budget wifi devices need advance feature like feature
'kxbrbhl',model number devices get print sticker bottom device post picture imgur also say wifi doesnt work mean see network name ssid connect connect get online last get online plug device directly modem ethernet
'kxbrzsp',really bill jump since pay gbps fiber plan year expire tell could get back lock year contract want break contract hopefully cheaper fiber company come switch internet data cap pay remove total since im lock ridiculous thats nearly half car payment internet literally fiber company around city cox force city sign municipal contract essentially state isps compete none nearby competitors move frustrate
'kxc87kq',absolute fuck worst
'kxcb17y',wire get full gigabit wire devices
'kxcb5uf',sanity check use different wire device different ethernet cable
'kxcb8hx',civil
'kxcm6ei',ethernet adapter settings show full duplex
'kxcwx2c',self register app might stick self registration second device probably emta take phone service order get better price provide little info pretty much impossible help
'kxcxgit',kind box iptv yes youll need cox internet connection model box small box larger one post box model print front
'kxd1ccb',device work wifi
'kxd8u9f',devices connect issue
'kxdqgen',cameras arent connect cloud use tons data everyday day none data leave home network nothing cox
'kxec9ht',need check wifi program laptop would say either update reinstall power laptop way may also need general update
'kxefdgs',wife lose bunch email initiate process sorry need talk yahoo
'kxeft6b',would go update reinstall
'kxehxp0',show wifi name ssid sound like something wrong laptop anything change since week ago drop get wet
'kxelia6',show neighbor wifi fine like one two network like ten different network work ethernet cable try find permanent fix read could need change channel change ghz cox let change channel already try change ghz
'kxen2u3',try bring laptop closer assume would connect via ethernet confirm weird affect one laptop channel congestion laptop
'kxeq7m0',bite older lenovo thinkpad funny thing roomate laptop roughly age work fine wifi yes router stay close wan na say feet away laptop time
'kxevrbz',issue light green modem blink orange try sign gateway say user admin password wrong
'kxevs6q',deal service since friday afternoon almost hours estimate service restoration worst service ever see
'kxf052e',lenovo thinkpad wifi nic wonder problem wifi mode google could find way change could automatic mention try change ghz include disable band steer https basically want check box split band broadcast band way check see either band
'kxf3grs',ahead give shoot luck still show wifi network somehow
'kxf5xss',yall update take box cox indeed replace free also get ta say legit helpful subreddit ive ever post question im post update bc people keep reply lol kinda funny cox worst customer service yet unofficial sub best customer service ive thank everyone comment appreciate
'kxfbyp8',type check laptop update try type network name see populate way may reason decide hide network
'kxfc4b3',grasp straw point happen intel proset wireless utility bottom right screen would another wireless symbol idea routers mode change automatic firmware update laptop cant see anymore bet roommate wifi ac nic along rest devices affect could try factory reset gateway long change name password back shouldnt cause problems devices feel wont help worth try
'kxfdt2c',android phone assume pixel dont think come native email apps
'kxfjjqi',cox plus years less speed great consistent recently switch mobile less half price even bar connection get think im do cox unlimited compare ill deal ever issue come
'kxfjtry',good give deal discount call complain every month
'kxft6ve',end effective tomorrow
'kxfus34',years pay tiered nickel dime years never waive extra unlimited strangle hold live full bar time never drop pay month another test full peak hours flat price unlimited
'kxg6rik',talk acp program program years acp thing end end april
'kxgcpv9',common passwords people use password bottom box
'kxgnixw',dont galaxy play create new account keep first account old message
'kxgyn2z',know comparable service cox lack intelligent service options pass extreme
'kxh00w0',sigh throttle throttle use vpn would nt matter throttle would need change actual cmts control flow rate basically throttle occur would need result modem configuration change limit flow rate point vpn even able cause get speed sound like inefficient rout problem hop somewhere cox throttle
'kxh0j6s',cant change modem configuration due own cox provide cox additionally throttle base device ip ip router run separate modem router setup
'kxh1dtu',matter own modem think sign speed tier service modem actually work registration process one parameters update modems configuration file ds us flow rate aka max allow speed provision whenever call upgrade downgrade speed tiers either ask reboot modem initiate update new flow rate update registration doubt something go say definitely throttle
'kxh1m9q',suboptimal solution cant move email way
'kxh225s',file single source via vpn get different speed mean throttle ive determine theyre least throttle computer ip modem router idea lan computers ip know ip address assign throttle base youd still see bad speed vpn vpn doesnt magically change ip address cox assign ip address still use connect vpn providers network
'kxh3he9',mention test multiple different file different source different devices also one time test test different days time well also know computer ip ive receive letter previously ip list previously torrented game forget turn vpn vpn doesnt magically change ip mask isp isnt able see
'kxh5492',vpn doesnt magically change ip mask isp isnt able see correct
'kxh5au7',understand however initial configuration provision configuration adjustments also ways throttle internet speed aside throttle modem via configuration isp although illegal easily implement intermidately relay throttle service would explain high packet loss network disconnect im experience
'kxh5q00',packet loss disconnect fancy intermidately relay simply unmaintained coax network noise ingress cause issue could also signal issue wire house
'kxhfeqq',dns issue vpn use different dns test vpn https
'kxhow4b',higher expense justify support time problem need tech get one day next day see several case take week get
'kxhsik7',separate frequencies cox wifi app almost positive wifi detect update ones
