MsgID,MsgBody
'kw68vw1',definitely get standalone router port forward check something like archer series theyre reliable pricey solid port forward options plug current setup good manage settings remote work also check thread check people say https
'kw69ehy',really doubt earth would get cable tv help internet speed sound like load crock
'kw6hrwe',suffer cox monopoly sick
'kw6rjho',little choice site store work home need able get internet work day hate price hate customer service people actually know solve problems really need level tech time even gamble
'kw6vtzt',competitor would dump minute
'kw71pdo',get gig unlimited data also area importantly hate passion
'kw77to0',someone work similar company monopolistic footprint service cox area area cox service area competitor customers move option move area one choice live multiple thankfully cox two copper choices fiber soon fiber finally move across main blvd outside neighborhood get verizon block cell signal due next damn freeway
'kw78ho4',login https cox email address password agree tos account active ask change password skip next need generate app password see https instructions get post https cox forum
'kw79h58',try share cox ip travel router vpn work need port forward reason also wireless tv box ask think need use panoramic gateway box work
'kw7bx2q',im work two different account step troubleshoot try account save type assume unless otherwise note follow requirements log change password perform verification log log via browsers chrome edge iphone two wife add new email account select yahoo enter username xxx mailto xxx new password set select mail save settings mail arrive immediately app look settings try copy yahoo mail similar list show google yahoo settings seem classify mbair delete account add original yahoo account form first time configure connect immediately mbair try use yahoo selection new account cox credentials item save account use default yahoo settings mbair add account fail limit initial credentials edit failure yahoo provide imap config error unable verify nslookup address enter ips verify dns errors result
'kw7cf5y',would suggest try different email client like thunderbird see work mb hear issue native mac email client would rule issue mb
'kw7cwlq',thank reminder try outlook mac windows ill go grab another client try validate ask would mac mail work yahoo preconfigured account type
'kw7eojn',canary try configure account fail use yahoo account type connect immediately
'kw7fbi2',finally work https https problem compound yahoo want use another cox email factor method hadnt verify either finally get use phone get straight
'kw7ghl2',thunderbird errors use recommendations change authorization redirect yahoo bam connect deviate instructions would require mail client oauth use kinda mess gon na keep try figure straight ssl config instructions state
'kw7i6o4',sir alan mixon super hero work initial connection fail opportunity change domain config beverage choice thank
'kw7k91s',dump soon home internet available cox unlimited would stay instead pay extra top cost tiers speed charge even get gig service monopoly use pay jump ship asap one point pay get upload speed need work
'kw7kxxm',today day cox come home install new cox fiber service cox pull fiber neighborhood nov feb saw change cox account log cox account saw new offer faster tier gb foe like think dont need speed dont like price note henderson nv rental property century link cox cl symmetrical service month anyway decide call cox ask new service anyway curious service would deliver though expections get answer low currently cox internet still use coax anyway phone ask service tier confirm avaialble home surprise say avaialbe like month weird number etc say rate new service contract term could answer either medium coax fiber home network rack plan rate year term schedule install today hour window idea need dont know pull fiber street side house like coax use use exist coax need new modem shall see update post experience
'kw7kygu',plan use work smart tvs replace gateway shouldnt troublesome
'kw7o373',connect router direct ont shouldnt problem see video https basic instructions although wouldnt need port forward options ask question run issue
'kw7qgpq',think apply speed particular service tier change upgrade tier cox prefer aka go even faster plan upgrade quite time speed upgrade automatic sometime signal reset configuration file doesnt work see https https different speed years overall good tip
'kw7s9ee',youre right request customer cox tech cox make call courtesy upgrade might apply large block customers also defense cox customers home network need understand limit exist network might cap speed vs cable slow network devices nic card etc today realize netgear run major constraint ethernet traffic
'kw80f2o',load crock thank make sense call next day remove bs previous rep add account tell rep never add note make change next rep begin shut crap fast
'kw8gise',cool let us know go finger cross fiber home
'kw8gvu1',concern could take yahoo mail put sun dont shine go websites organizations use cox email address change email address one gmail account easy cheesy nice peasy yahoo mail well know get hack
'kw8h8mj',say truth truth live central phoenix cox rare occasion outage jump right usually fix within hour
'kw8ho29',ask corrupt file could issue also node overload something wrong area associate get guy check things like real pain keister corrupt file thing may transfer level support
'kw8igs5',option centurylink old style hardwired copper line dsl cost save use verizon internet cover cell phone tower ft build side tower
'kw9kv5s',upload average around
'kw9l6os',upgrade lower speed tier december tell get panoramic gateway thats anything get rid late
'kw9lmsb',use router
'kw9lokz',choice would drop cox heart beat competition area
'kw9ovce',get rid long dont phone service
'kw9shor',okay dont phone service
'kw9skum',dont panoramic gateway cox give upgrade also mention upload speed direct ethernet connection computer
'kw9stw1',contact cox tell dont need anymore process work especially try establish service modem
'kw9vqeh',update suspect salesperson say get special deal fastest gb plan truthful exist mb plan modem rental shortly install team come subcontractor fine plan manage install anyway understand technology part type work foe enterprises base yes pure fiber install pull fiber street house house garage already instal run network closet simply patch connection patch pane unifi wan port fiber splice do street commscope equipment demarc side house fiber modem mu garage choice put signal test resplice fiber demarc begin work need router leave ip address come unifi router new fiber modem provision speed mb symmetrical cool call cox pro ask speed compare sell weeks ago transfer around cox sales apologize confirm rate pay tell foe speed remove router tell need return pay month mb tier however see ish fine really competition neighborhood cox get know fiber good install hours team instal pros know uplift speed need future get new unifi ultra router monday allow shape traffic cox vzw different network end point look forward excersize cox probably spend install sub revenue try upsell tv security voice interest would will sign year commitment foe faster speed trade lower price per month shall see deal come hope help someone
'kw9w2ot',good swap cant force use pano
'kw9w9hp',modem first call technical support say want put new modem account move internet service new modem need give brand model serial number mac address
'kwacu8a',didnt need add anything
'kwat67t',call tell want cancel weeks say require advance notice call back tell phone want deal call back
'kwb6bwh',im boat im get verizon home internet setup tomorrow cox ass last week push edge upload kilobits gigablast plan think get another service years wasnt options recently dont want fully switch verizon unreliable far tower
'kwbjw8f',disgust criminal wonder lot ppl know also cancel service option thank warn cox predatory practice stay away sure hope get justice soon bet time cox kinda crook biz stuff surprise class action lawsuit cox
'kwbkgkb',pure evil saw op https
'kwc11zj',pay penny need sales reps one job get pay much possible little dig may also find special offer basically price break one go get plan free years
'kwc6ec3',trust sales department
'kwcbjld',sell debt within define standard time limit could occur resolution company would error part would anomaly would guess happen cause extend drama go debt collector inform resolve uncollectible group debts own sell bulk another company instead take loss would go quiet months start different company buy debt take amount time new company process maybe
'kwch9pf',light gateway modem router combo correct dont see activation could change physical signal go unit maybe problem something docsis gateway signal problem signal either way doubt would use reason upsell panoramic gateway make money would suggest separate modem router btw easier troubleshoot
'kwciunx',update great news fiber home curious fiber box placement get put inside garage expose wire outside side home also old home hop cox upgrade older home fiber new construction
'kwck1xo',always run special offer like rotate pretty quickly look see
'kwcp26n',look could recommend modem router combo buy bern look sure router pair
'kwcsan6',point interface similar exactly cable run street pull commscope underground class fiber one strand commscope box use cable tap conduit use old fiber run demarc home build discovery park area henderson fiber cut pull commscope inside class fiber much jacket material protection underground type demarc place pull fiber ft per instructions garage area two exist run terminate network closet second floor patch panel inside fiber cut fiber splice do street one dmarc use simple cellphone size plastic mount two splice do one fiber connection back street one inside fiber ft run end point garage end inside fiber fiber ont power device mount splice do fiber ont supply cat patch cable fiber modem exist cat cable would terminate network closet patch panel another cat patch cable wan port unifi router replace cat cable old arris may redo future remove move fiber modem directly network closet basically exact approach side house directly network closet ultimately go attic could work ahead time enough information type install go do know fiber type connector type need get contact info installers independent contractors could get splice work desire buy tool let know question
'kwd1dnw',buy internet stuff buy use refurbish kind stuff modems use internet wouldnt cuz could blacklist cuz equipment like register another account never hear dirty filter cuz like oil filter car im expert technician dirty filter thing sound like bs story ive never hear since ive internet since sorry couldnt help hope get figure good day
'kwd281v',modem control put laymans term file throughout years cox ive hear many people call corrupt file cause problems speed
'kwd2lje',get internet place modem router supply
'kwda28q',great modems future proof ethernet port capable high split faster upload want able swap modem cox store warranty also consider technicolor https much come budget router come budget wifi requirements suggest wifi router devices arent compatible come wifi wifi however check devices see capable like asus routers good user interface imo lot options however others suggest seperate router wifi ap something like unifi look blind suggestion like pro dual port faster speed wifi good match go decent look save money
'kwdd321',year plan change plan anytime cox acct login
'kwdeysc',point rant
'kwdezri',agree
'kwdf128',keep eye
'kwe1kj7',cox internet vzw home internet wireless dont like price cox offer really competition neighborhood centurylink dsl option good enough anymore need work home audio voice call actually yesterday cox convert docsis base service pure fiber symmetrical speed gb plan month fiber get mb docsis via cable better reliability good years pay attention signal level arris modem support need rare struggle time past thing help years ago run new demarc point directly modem network closet take measurements modem directly connect cox side connection reconnected modem new directly run take measurements able procure band attenuators get signal level close dbmv channel dbm always measurements handy ever need tech come understand technology dose patience always help fiber cox henderson nv next vegas guess lucky neighborhood get fiber retrofit neighborhood home build rental property henderson year old townhouse centurylink fiber pay month gb symmetrical service gb symmetrical service cox primary home downgrade cox use pay extra month unlimited data use tb per month add vzw home internet connect connection ubiquity router load balance service ensure use lest tb cox also redundant connection either one go
'kwe61c2',know offical sub cox right talk users like second say wifi mean wireless connection internet general wire connections fair wire affect wireless consider get router
'kwe6f61',know honestly point post steer potential customers away awful service wire connections wireless completely nonfunctional cant use ring camera smart tv computers hue light anything require internet house regardless wire ive cox customer years go least time month
'kwe710u',saw lot sound like think talk cox also people mark post rant post rant post make mods either way look cellular internet service starlink
'kwe7aqo',starlink get lower speed reason cox gig plan place usually like lot people use internet house
'kwe8jpt',isnt dependability important speed seem complaint also actually use anything lot people mean even everyone use max stream could people house iot game usually take little bandwidth say options vote wallet hurt cox complaint
'kweb1pn',house constant outages nearly two years deal cox figure splitter street corrode cause intermittent outages replace havent issue since
'kwekdtv',ask need massive speed im gamer
'kwenbdq',experience option upgrade cox business give sometimes never ever ever advertise new broadband requirement definitions hope cox get fin false advertise
'kwenkoj',things need good upload security surveillance cameras require bare minimum upload work properly plus work home need vpn impact upload also upload need buy gigablast get past upload dont need gigablast overkill need charge another unlimited
'kweqbhf',sec camz require fast upload confuse
'kweuchx',hd dont know thats requirements yep one need minimum upload speed
'kwezed0',state monopoly wifi mean folks choice would steer
'kwf26bx',check camz amazon wyze blink chinese generic none show spec require certain upload download speed
'kwenbdq',experience option upgrade cox business give sometimes never ever ever advertise new broadband requirement definitions tmo vzw meet requirements cox longer able say broadband
'kweqbhf',sec camz require fast upload confuse pretty close
'kwf2npw',go cable fiber tap modem verify issue isnt thats first step blame provider think crack pip house blame city water say problem isnt local infrastructure cox thats first step dont trust cox tech hire av guy go cable fiber line verify ok need replace children wine grow men fix problem themself
'kwfb2r5',confirm answer username admin password default wifi password find router factory reset device doesnt change either must
'kwfpmke',need confirm problem many people know complain wifi problems blame provider problem actually thier home exist wire get everyone tech background suggest people get educate tech get io service fro provider install cable modem modem get router separate router wifi cant get mesh router multiple access point check costco best use ubuntu unifi tech use wire cat use wire
'kwge48r',lock sa business internet dont get address trouble pass address get ubiquiti router cell modem use tip
'kwghcv0',apn setup use suncomm router quectel chip use pass tmo unifi router instead suncomm create network unifi connect slaac
'kwhr0cb',call cox years work gig equipment tax include also waive set fee since verizon fios call one answer hold forever work
'kwj1q9u',im mistake think youll need log yahoo servers first accept term condition use third party app access email try login email first
'kwj1xot',yeah sound right bad netgear pretty shit hasnt get let even though thats effectively ive try thx sanity check netgear garbage literally thrill idea spend towards another modem good know im basically replacement away things work p like btw find didnt mmwave support despite kinda sour impression bite havent hear much otherwise quite curious get take performance
'kwj3owa',schedule technician come check everything excessive noise issue tech confirm issue simple fix require cox technician
'kwj4oo3',ive say ever since start wouldnt let yahoo handle toilet paper go place use cox email directly change gmail didnt fool yahoo
'kwj5g9g',never good experience anything netgear tmo currently little mmw deployment even tend attenuate power cells make range really short live get cells able get vs quite happy
'kwj8iv6',already appear yahoo try make pay dollars month set email forward https https insane scam
'kwjvtz1',wifi hardwired id hardwire laptop pc directly modem see speed whats ping look like packet loss
'kwjww21',wire unstable ping packet loss
'kwjx50u',home internet
'kwjxb6a',panoramic gateway upgrade free already pay gateway take speed problem wire vs wireless
'kwjyaog',schedule appointment technician check wire signal level inside outside last time technician
'kwkqb7d',issue current plan could technical issue technician resolve upgrade work really well always better speed right amount upgrade hurt continue issue even upgrade problem hop info help
'kwkr26m',issue fix switch quantum fiber internet pay less half cox charge download upload data cap pay month price life wont raise price every years like cox
'kwkrbt7',stick cox sadly star link
'kwku8sg',use social security number open account cox telecommunications service however might pay deposit except internet modem
'kwkwpdq',shame screw twice shame
'kwl7dht',trust sales department matter tell juicy offer may sound like better trust tech department people honest sh sales retentions
'kwl87o2',lucky get fiber symetric service area really glad read problems service far well kinda expensive
'kwl8o77',know yahoo charge dollars month decide foward email information never give cox exployees always corporations mess people lol cox email sht yahoo even worse
'kwl8p7h',scam
'kwlggky',make business sense access yahoo mail web portal free account see ads back day use pay premium mail client access would way go
'kwmeemt',modem phase
'kwmeubi',excessive noise line need cox technician check noise come could simple bad connector technician able figure pretty quickly
'kwn5ivi',try assign static ip address keep dynamic cox doesnt offer static ip address residential customers upgrade business able assign static ip address
'kwnku1h',phone port ont cox let use pano free charge phone service even use data use cox device get phone service
'kwnrq4a',typo hope werent offend stand comment much money mega company make youd think could least decency provide us base customers onshore customer service offshore reps barely speak rudimentary english
'kwnsqiu',work want hang router directly ont without pano middle assume go force pano middle hang router pano beyond turn pano able disable rout
'kwnun74',disable rout pano ewan mode need onts mode cant put bridge mode
'kwnv7bt',go contact home security provider see internet monitor option get rid phone
'kwo29tt',ok yah many security systems capability
'kwocv24',understand say agree company provide job express frustrations international reps difficulty english without racist statement like rid camel work stuff like remove credibility argument
'kwog1zr',acp program live welfare office etc supply outside information
'kwpek3e',provide emta phone modem charge use internet modem well hook system save monthly rental charge
'kwphbs5',tip would great could post cox forum https notice lot people confuse subject know app password know generic email account tip mention step thank
'kwpideq',ftth areas op refrencing
'kwpinwn',work king among bug
'kwpiotk',guess could try disable macs https instructions wireless similar wire terminal command networksetup ethernet
'kwpvd2q',ing static ip address keep dynamic yeah ive try go dynamic well result unfortunately thank advice though
'kwqs95b',get email successfully transfer yahoo use suggestions work iphone cox note transfer realize delete cox email account iphone go try reactivate cox account try contact yahoo hold hour cut line accessible somewhere many important note need back
'kwr4bf2',bros jobless
'kwr7j6q',well know market isps market lower comparable cost speed usually competition options good internet service cox landline approach neighborhood centurylink option dsl use monthly add cox bill unlimited data add vzw less allow route usage vzw home internet get benefit redundancy see really choice pay
'kwrffpz',call tech support go troubleshoot theyll send tech
'kwriu6r',mean capitalist right
'kwrokn1',struggle last weekend give fiddle hours
'kws56mo',backup computer recover make sure mail note select yahoo account first note select copy cox youll need go backup prior email transition find folder user yourname inside folder youll see another folder library inside folder entitle mail inside mail find yet another folder entitle v x x number os case run monterey later may even copy move folder place mac download put mine open folder youll see lot folders alpahnumerics top list correspond email account mac one cox account figure folder file case note folder want recover go mail app mac select import mailboxes youll need navigate file locate earlier note select dialog box recover note file problems dm
'kws6cnl',cox forum reply post use yahoo mail mac thank link btw ive never actually use cox forum typically know csrs talk cox get level tech dont lurk forum years
'kwsbvo1',cox matter fact trash cable company theyre scam tv invent free cable get ahold everyone drop cable maybe us old people social security could watch decent movie
'kwseg64',help issue sorry age
'kwswwx8',free channel network ones ones cable provide also network broadcasters lobby congress force cable company carry station force provide channel first broadcaster charge cable company carry channel ya know stuff put free
'kwsx4pw',use cox dns servers else try test say google dns
'kwt8tem',try google dns work google api service also reach server
'kwt962k',sound like cox rout issue dns recently change take hrs update
'kwtbeb5',use post lot take step back forum get move khoros platform tons bug plenty people still post question watch trend reason ps still hear cox phone support get outsource south america place wouldnt even doubt moderators outsource
'kwtc4k4',least recently year ago speak level use know bo level guy region lot turnover would surprise tech except perhaps business account turf overseas
'kwtfyku',much give try appreciate
'kwtjz81',wifi network longer broadcast issue equipment could possibly someone change settings publicly broadcast rare try factory reset see get network broadcast pano need swap dont want wait tech always ship one swap store
'kwtl64i',instal modem tell web interface come later accessible weird vodafone modem normal web interface want turn since also router already shitton network around obviously cause problems
'kwtrsnv',help
'kwtybsc',signal level see https instructions get upstream ofdma channel upstream channel also log say around time slow upload dont post log unless edit mac address privacy reason general look see timeout errors log
'kwu7xqt',static ip issue
'kwu9h0q',packets leave cox network issue lol
'kwuempe',toss upvote make laugh loud thank
'kwug3u9',issue day customer saw data path normal cox ip rout ip supervisor advise bc older docsis modem need sup advise get modem elimate xxxxx ip hop
'kwuquqe',tinker cost qualify dont touch probably end pay fix tinker cost real problem
