MsgID,MsgBody
'kxhssju',literally change plan online call say want speed
'kxhug9e',lady let first sign say possible rant obviously know
'kxifkfn',throttle limit youre pay less would congestion local node config issue lan devices cause performance issue feel like legit gripe cox file fcc complaint report https come reddit toddler mode cry fight genuinely try help isnt useful cox jump fcc complaint
'kxigq2u',yeah cox go something know lot people switch get way though finally switch run bill bs monthly bill count equipment charge
'kxigweh',youve use imap move email new email program email would still server visible new account app
'kxjag7q',ont phone port theyre able deliver phone directly via ont phone ftth require pano https
'kxjnuyw',depend city closer per line line discount check imei number devices make sure approve cox mobile best bet find direct sales rep visit nearest cox retail location departments get best offer cox mobile get big discount internet bill cox
'kxkfoo3',change att hard understand
'kxkzefw',remember years exact things never reach limit one month next keep go could never figure keep get ding fee finally switch extra month stop madness pay plus another bill almost every month add unlimited see data go back normal pay extra
'kxy585t',try remember post tomorrow
'kxy5o0v',router ive test via speedtest reboot modem back full speed doesnt seem node saturation issue ive get devices internally
'kxymwl7',retention dept able get plan price drop
'kxzhpzu',see op pay mbps additional online discount likely go work rack rat stack promotional rat say look connect assist program lower bill speed modem include overlap qualifications also school age children live house one month speed include modem
'kxzhvnc',connect assist program lower bill speed modem include overlap qualifications also school age children live house one month speed include modem also verizon try home internet go low unlimited data get much mbps data unlimited
'ky0g6o7',dont believe change password cant get
'ky0o2jy',issue husband get app either reset router pause devices piss lol
'ky0o9hm',sure use change wifi name password block stuff bigger issue happen
'ky13mkc',assume mean surfboard surface next model print sticker bottom side last model panasonic device cant find model number post picture imgur
'ky14u7p',thing op may confuse various word modem router bridge mode
'ky17sqg',save
'ky1r0ek',chat follow script require sometimes sell stuff better call support get modem swap
'ky1ua0r',surface fix turn ap
'ky1umxh',realize box somebody connect tv ethernet actually cable box sort move ethernet cable good
'ky1v8fc',platform sound like look cable box picture https different kinds ethernet connect box router get internet dont know get public ip weird glad figure though
'ky203e0',contour box ethernet port sometimes panaramic whatever
'ky205gc',box yeah
'ky29ogq',total fakeout ethernet port contour guess must provide internet connectivity contour though appear work perfectly without
'ky2atjz',update usually use years one contour box end im use internet panoramic gateway
'ky2b3tw',panoramic modem fan ive never encounter modem fan always room someone sleep pathetic hunk sh
'ky2rqsc',dont need use cox router plug ethernet ont wall box straight orbi
'ky2uexy',unifi
'ky330k7',cox tv service cox phone shouldnt need panoramic gateway dont know force users use even service doesnt even support
'ky35w2y',internet right modem orbi router system tell need gateway coax cable guess modem hook via coax sure try get use imagine turn fiber optic everything hook way current modem router
'ky374nk',coax cable isnt true fiber aka ftth maybe rfog mean would either need use panoramic gateway modem something like https outside home utility closet another way tell look online upload speed higher rfog could put gateway bridge mode https pay something use half modem side get gateway free contract usually first years pay monthly
'ky39fkg',understand know think deal fiber power high speed internet true fiber optic send gateway use use regular modem router scammy way present save money similar speed probably
'ky3abdw',regular cable internet docsis call hfc hybrid fiber coaxial thats internet node fiber last mile coaxial still shadey call fiber though ask orbi yea work forget combo
'ky3c8vr',would try use gmail mail client android phone able get wifes email transition work little trial error issue still gmail doesnt really like send group email
'ky3khfd',u able get take
'ky4iade',question better address arent really specific cox
'ky4isi2',seed copyright material internet u get chance frox cox shut internet completly could movie could game could app program could anything didnt pay people peeer peer network like bittorrent utorrent download ip addrees download copyright content doesnt thow flag cox seed content
'ky4j4s9',thoughts definitely check source email sender legitimately cox help company run website fb page integrations get lot baseless copyright infringement warn appear legit first bogus url want click say fb etc big flag realize hoax spam bot etc im say anyone initially get message unsuspecting like may scammed link click say notifications arent real legit im say perspective get lot lately email may get batch attempt phishing could possibility
'ky4jdt1',could even mobile device like cell phone tablet seed peer peer client like bottorent utorrent u find delete file uninstall peer peer app
'ky4jloc',hear people use vpn
'ky4lou4',response feel shut would already either way wont bittorrenting worth
'ky4mz5p',go reply comment could jailbroken firestick could someone share wifi detail share wifi detail confident non network devices use fing help sniff network cox app helpful see connect previously connect devices arent currently actively network use compare detail connect devices service like firestick app form seem like arent pirate base like video content protocols connect could trigger
'ky4nppj',add another reply another user may another source notification trigger may totally legit cox dont get wrong say condone approve advise ignore state since werent able see directly set alarm family may another device friend maybe network need new wifi somehow network sniff guy share residential single family home know thing filter network device say disable use cox provide use moca backfeed another device may connect directly may know im go full wild chance know case filter miss scenario someone tap coax fiber really extreme thoughts possible
'ky4wjd8',use havent active def want get back bittorrent download many reason
'ky5i0h9',days norm depend area
'ky61gj1',want add tv use lot data transfer sayin
'ky6b187',finger cross
'ky76z31',way go stuff like question
'ky7fby3',probably dumb question call set disconnect date prior eligible get reconnected offer bill history increase also mbps plan click link post best offer online speed seem like great deal
'ky7fqej',get use vpn youre go torrent anything forget one singular time last year receive letter download sims expansion pack
'ky7kusc',detail modem https https modem model https https
'ky7mbfv',downstream little high although within technical spec also uncorrectables ofdm channel high assume recent reboot signal amp https somewhere coaxial leave street room modem last upload download slow
'ky7vyjn',mullvad shoot cheap privacy orient
'ky8kmtj',get couple strike go shutdown service get closer limit website redirect take cox page tell theyve get notice filesharing yada yada info direct remove app stop share theres link bottom click viewer agree stop share remove copyright file restore normal web traffic youll fine decades since first notice notifications contain threat ultimate account sanction service termination work cox support like years ago get mail letter notify id detect heckin dcma infringement activity could result account termination several employees time lol one guy get like notice never internet account terminate
'ky8r0ko',pretty much plan sign cheapest mobile plan gigabit internet plan discount pay total depend location small tax top mobile service usually another dollar two tax contract cancellation fee cancel mobile service time internet rate would go back normal price even use mobile service add secondary esim iphone leave turn basically get cheaper internet price
'ky8r7fa',backwards right keep phone break bundle
'ky8rev5',promotion right cox make internet cheaper mobile example market cox cable internet unlimited data could save cox mobile definitely check service agreement read term condition tell exactly sign additionally check providers area example areas cox serve also serve fiber verizon fios google fiber may find cheaper faster reliable service go
'ky95qxt',case first time call say cm sb mention agent tell press factory reset button least would wipe account info previous owner work leave case someone issue future dont want make fake serial number tldr buy modem amazon press factory reset button least activate modem
'ky99t5d',box wireless box cox also channel right use box stream device support stream service would get wireless wire coax box old
'ky9azrm',vary alot base competitors available address ive see customers get gig download upload month year gurantee century link fiber also available customer cox price compete areas cox available competitor run old dsl phone line download speed poor cox take advantage charge customer service money game always always
'ky9ex5v',want say outages freak ridiculous pay service service unavailable still bill hate cox company deal deal option
'ky9fogs',decline insurance policy cox provide still tech visit itll cost fix issue know people get issue fix cancel four months either way issue fix without good luck
'ky9ikde',unnecessary sales push current customer blah fuck
'ky9jp10',agree think techs offer appointment push pressure
'ky9mblc',thing happen take box back cox store get employee sort happen would notice discrepancy give new box thats tech support make worse keep want send technician would bill fault say go back tell guy swap gateways help sort tech support
'ky9oifk',yea hide fee go pay different price switch cell provider switch months back bill high like one line iphone pay say bundle phone would cut absolutely internet bill go great also get extra iphone son plus unlimited plan also great consistently bar live vegas near strip suburbs area live well develop though never signal issue soon enter local grocery store signal go straight sos weird importantly switch offer insurance call back next couple days prior get sons new phone tell late could longer get sign initially argue whole day rep offer let know circumstances yea pretty piss since teenager new iphone yea bill cut half
'ky9rkls',husband get piss know piss thats wont give pw cox app lol
'ky9s2ae',pay discount cox unlimited data rent modem without discount think get rip wait longer new customer cox give customer loyalty discount jk youll really feel rip
'ky9xgw6',able finesse new promotions old one threaten cut service tell long loyal key leave room say demand polite direct way need promotion even need talk supervisor get one representative uncooperative call back get one authority give exist customers new customer do
'ky9ze7e',customer since even sell internet service use buy telephone service dollars come dial dsl highspeed know mean every months acp try raise doesnt even take much finesse explain cant afford wan na schedule service cancel mess part show little customer appreciation stop make us jump hoop discount could afford apply hope fcc bring back net neutrality cox could go back company didnt mind pay
'ky9zxz3',good internet provider would justifiable see terrible toxic
'kya2leu',want tech dont worry dollars take lot get charge typically main way charge happen something like input issue case modem router problem also situation dont stress want fix phone need supervisor tier support correct mix could also go store agent help try sort well
'kya5z0h',man see comment id like come fix u free things possibly wrong signal level low box function properly old incompatible cable amplifier use b ok u go ur basement look wire house u see black amplifier green light thats issue u dont see u need tech come signal meter look deeper say cox reps phone much dont hate persecute tech come come u thats cox last line defense try hard fully resolve issue point
'kya7o4o',bf sound uninformed deal fine
'kya8ux1',free internet base one thing get pay cox free internet joke
'kyaabu3',hear appreciate chat leave skeevy scamy ill give amplifier check morning thank
'kyaamxz',search
'kyafin7',depend house use internet tb quite bite
'kycitlg',general approach cox use offer lower monthly rate internet service mobile service cox provide decent imo use verizon wireless network need new mobile service provider perfectly happy service price receive verizon market las vegas gb plan get ask mention work home sure entail many ms team call week voice always video time also standard access apps cloud systems service oracle netsuite also devices connect network mostly iot smart devices wemo water meter smart irrigation etc tvs directv stream roku stream netflix prime etc tell service cox mb speed need work home support devices network meaningful thing saw different gb service time load roku stream channel perhaps another second additional time load everything fine gamer go back gb service recently pay recently upgrade true fiber service speed tier mb mb mb gb even gb symmetrical mean get download upload speed latency reduce significantly well ones cox internet service today supply via traditional cable upload mb mb want additional upload speed sync many file good amount large cloud storage many file change repeatedly depend work home need easily get lowest speed cox offer power work home tool imo stuff might use home game video etc thay may drive higher speed last comment especially since many folks work home since pandemic one problems connectivity consider mesh network days one device fade due demand many connect devices also use wire connect device use ethernet cable good luck
'kyd1w1x',arizona take equipment up store get receipt everythings do free easy cheesy nice peasy return equipment store get receipt equipment return would go back store say receipt problem solve
'kydjggl',dad receive many brother live home cox cut service unless warn time though idle network speed cap lower pay cox tell inquire father behalf
'kyefzoj',sure requirements begin think benchmark speed basically ever isp feel like hard date could find
'kyekwmz',apologize maybe poor choice word part gather isps want govt fund go need offer new broadband threshold plan fulfill requirements date effect gather
'kyezn0u',like bundle discount get nerfed see month plan vegas new customers get larger bundle discount probably good couple years
'kyf9wyv',u shud definitelyyyy hook thst still relevant
'kyfu867',dont signal amp im aware box side house set bridge straight cable go side modem uplink download go slow around upload still edit speedtest result minutes ago reboot modem yesterday afternoon https https
'kyfunf3',take screenshot modem couple days build errors couple channel pretty quickly
'kygeuns',gigs world wont save constant outages unfortunately finally give go back verizon internet outages months cox service suck
'kyhbbri',kind modem router recommend issue cox try upsell follow advice give instead blue blink light green world icon isnt miss wifi able connect still say connect internet modem maybe years old idk router though
'kyi7ngh',light modems topmost modems power light follow send light receive light online light modems light link light change color may blink steady depend status typically arris modems send receive light either blue green depend whether signal bond establish connection blink connect steady online describe globe icon light blink connection cox establish become steady indicate stable connection modem connect router via ethernet cable also show light amber blue indicate type ethernet connection exist light color especially blink red yellow indicate faulty connection description establish communication cox light indicate bond course follow modem connection router moot derive signal modem many possible reason issue things try troubleshoot basic power modem router unplug power adaptors unscrew remove coaxial cable modem wait least minutes reattach coaxial cable reattach modem power adaptor turn modem reboot go sequence four light solid light case reconnect power adaptor modem power wait till see light light without blink point internet connection wifi signal case youll need call cox tech support run diagnostic remotely tell issue signal may dead die modem modem come back power router see router may dead die router replacements need cox support page provide list nmodems support range price fro less many hundreds price necessarily indication quality days unless live house small size one level suggest buy standalone modem nighthawk arris decent sure buy modem docis cox phase support docis like te one devices failure common element power supply mean tghat piece effectively dead imo perform well separate modems routers reason wi fi reception issue larger home multiple floor hard reach areas may want buy mesh system router multiple nod connect others wirelessly provide much better signal quality range single router typically single double triple nod cost hundred many hundreds dollars depend number nod etc like tp link nighthawk standalone routers good quality decent price youll want model find less mesh systems eero easy set work well tp link also sell mesh system use modem though use shop around able buy standalone modem standalone router combo go mesh system still able keep depend number nod need figure one node per floor multilevel house add areas unable reach exist router general rule may want buy much know need see whether another node need
'kyilyqu',term service mean https dont see anything permission house ground could include link possible copy text wonder guess maybe something gateway need property within range connect hotspot
'kyip05w',soo find say tell make sense thank
'kyixsog',instant fuck cox shady business practice
'kyiy0hh',shady tactics
'kyiyh3g',feel like change roommate account primary account benefit difference lol
'kyjvfgo',try trick youve customer least year recommend look subreddit theres multiple post tell recommend chat setup cancellation date
'kyjvqsq',look
'kyk1oym',much data
'kyk2kih',talk wifi cox around various cities talk wifi hotspot make mobile phone
'kyk3k9p',hotspot cox communications
'kyk59a0',likely whatever data limit home internet come folks cox gateways though im guess thats terabytes unless youre pay unlimited im sure ive unlimited data also pretty decent mobile phone plan im pay
'kyk5u29',buy arris surfboard modem already nighthawk router im confuse cox add modem account show green way world icon flash green router show internet offline make sense since still show internet access cox fool
'kyk6je0',make sense thank
'kyk7ath',talk cox wifi city wide hotspot cox internet customers
'kyl1kd2',question happen im stress
'kyl1rce',make sense sure plenty happy customers cox easily worst isp ever though huge margin fact experience frustrate come online say pay month yet often barely crack
'kylojcv',point need rule modem determine whatever signal present sufficient may assume instal modem call cox provision mean add account issue provision quite likely signal level low link article tell check signal level arris modem instructions apply arris modems long ethernet cable laptop good deal easier need connect computer modem directly access modem admin screen check signal level even computer internet access connect doesnt require cox tech support connection internet via ethernet cable computer modem router would appear issue outside cox responsibility try connect computer via ethernet router follow instructions interrogate router plug power adapter modem router power outlet turn modem router wait power lead become solid green white type login credential default username admin default password password netgear genie page open click diagnostics
'kylz23t',happen scummy way treat customers badger let sign acp line pocket taxpayer money file complaint fcc bbb
'kym9vh1',modem provision account see thing happen
'kymdxgb',long customer dont mind ask
'kymecpv',usually call customer loyalty number get discount otherwise tell thats discount really biggest discount sign ready leave tip
'kymexw6',high price internet unlimited data many customers stop pay already expensive cable tv switch stream online instead much cheaper itll literally cut bill half
'kymfku3',use pay almost internet cable tv cut cable start get proper discount loyal customer end cut bill anywhere month instead cable tv start stream stuff use stream service way way cheaper
'kymksff',model modem also default dont work try factory reset last problem happen connect pc directly modem ethernet
'kyms9sw',rid cable tv imo cant keep one box
'kyn32au',black amplifier green light
'kyn9q8h',almost years cox even get rid tv phone package still pay buck month internet finally options come dump asap live show tubi freevee
'kynnoth',store signal go straight sos weird importantly switch offer insurance call back next couple days prior get sons new phone tell late could longer get sign initially argue whole day rep offer let know circumstances yea pretty piss check newest fcc coverage map https https national coverage mobile broadband theres data theres voice say may prioritize core verizon customers neighborhood might better price bundle theyre place save decent money take sim dont use youre market discount worth see competition xfinity seattle take phone bundle two years reduce bill chunk major problem cox bs tb data cap anything stream include stream subscriptions cable box count cap ive get two users house vpn office another college class vpn school ton stream netflix youtube cruise cap month without issue need pull new distros linux work systems dont care pay extra care song dance sales pitch spend five minutes want max data never talk century link non issue synchronous speed data cap deal crap phoenix customer care reps get phone seem bite sharpest tack fortunately theres new fiber company part valley theyll thursday replace cox service synchronous asynchronous crap cox toss around less favorable work vpn one vpn connection work im least cox two years
'kynwwck',years
'kynx3ff',get ta get laptop chat set see get lol
'kyo17dn',get resolve im still curious level look good forward pretty high spec return spec look level tell theres splitter sure someone else mention amp say field tech preferably escalation tech need put ping plotter monitor issue look node see trend trouble call intermittent noise
'kyo2t4w',cable portion dont lot people live definitely stream lower bandwidth tiers sure unlimited bandwidth addon cost get apple tv nvidia shield tv box use online stream service tv build would use one two time
'kyo3fqw',resolve yet ask escallation track issue feel kind weird really regular interval fine week notice slow download stream buffer check borked reboot work know long say could probably run script nightly really get properly fix
'kyoc5tu',always use modem currently https https
'kyobahb',call number right solar eclipse straight ask discount account gentleman right away give think ask say actual plan could discount say original discount plan gon na expire though call ahead say today show recommend call back days ahead discount plan expiration could option get discount plan use months instead get discount plan first may months originally sept think cox automatically double speed exist customers mine get someone try call number think apply discount right away without cancellation try way hope work others good luck
'kyojjv4',work sorry reply old post issue connect via ethernet anything involve network isnt work
