MsgID,MsgBody
'kuwy722',pretend youre pirate use vpn like proper pirate
'kux51fi',reason get certain peer monitor torrent report cox cox see actual thing download use news group go get notice
'kux58e3',reason delete anything cox see computer fuck sake
'kux7bj0',tip
'kuxg6u6',win useless comment award today
'kuxhr8z',go aol still available bunch doobies
'kuxso2t',come across post similar situations make informal complaints fcc subpar service service providers follow link https https
'kuzk7ol',use torrent client perhaps still seed background really ought use vpn
'kv0aomt',oliver chat bot dont expect nothing abt chatbot
'kv173go',wifi modem
'kv17a9c',cox doesnt provide wifi provide internet
'kv1lk7d',create one time passcode security area yahoo order import email gmail account also need change pop smtp servers yahoo username full email address instead username like example instead example
'kv1lpoo',bring back memories newsgroups dreamcast game
'kv1mmoo',get tmobile home internet black friday still cox gb plan im still test tmhi get speed depend time day congestion latency also higher reduce use router sqm
'kv1vdcg',send instructions miss along new servers info current login credentials carry thank
'kv21wen',google yahoo pop server settings find support article server settings password use email clients yahoo require change password dont use password gmail import email create one time password device
'kv256hb',find odd multiple cities area get google fiber instal cox formal process get fiber community get sort help get something run even contract
'kv353z0',think yahoo die sell insane
'kv3vxan',try repair via network settings windows
'kv44m07',use cox router send one send back
'kv4prar',long take internet plan change assume upgrade downgrade internet
'kv5683m',registration process netgear skip cant figure read instructions usually start
'kv5i0mi',number still discount expire next month ill need
'kux51fi',reason get certain peer monitor torrent report cox cox see actual thing download use news group go get notice
'kux58e3',reason delete anything cox see computer fuck sake
'kuxhr8z',would go aol still available bunch doobies
'kv353z0',think yahoo die sell insane
'kv5mpyt',know im late party cox definately block vpn proton also try ipvanish block well soon disconnect vpn internet magically get connect guy say way cox isnt block vpn fault wrong sadly cox monopoly area even att choice mean one isp im country anything pretty big city
'kv5xclw',whats go system cox tie internet speed package change rental device use device call tech support see drop since work order system modify include equipment
'kv5ygl0',restart cable modem lot time
'kv5zwpi',late thread throttle connection actually prove billionth time minutes ago download file get estimate download completion absolutely ridiculous im gigablast plan turn vpn would know immediately able download file minutes decide apparently throttle mine base ip would switch providers except provider available virginia
'kv60a9k',lie prove minutes ago theyre throttle mine base ip estimate download completion sit like minutes turn vpn magically able download file minutes
'kv6303i',oh ive change yet second post ive symptom grab pitchfork join email changeover post https
'kv64fnh',guess start
'kv6omey',much
'kv6vvne',mind folders old email make move
'kv73pe8',never create folders
'kv7ox6o',even say get line
'kv7tkuo',convert business account like bank stuff gmail
'kv7tumm',sound like router update software try see suggestions see exchange whoever buy
'kv7u4f4',wouldnt use yahoo let use hat go place need email address change gmail account yahoo
'kv80qoj',rant cox keep get away charge people plus dollars gigabit internet come home long day work watch tv find internet look website outages unplug router plug back thats ask complain find internet speed theres get something make much money shit like allow
'kv8m6s0',email havent completely migrate currently theyve migrate areas contact cox employee tell base region migrate end march also theyre send notifications days migration visit complete migration
'kv8w8l2',neighbor cox speed reliability issue
'kva2sb6',smart cox verizon never use email always use gmail
'kva4pyf',like try split network admin site need download panoramic wifi app split unless panoramic pod
'kva67fl',lock app
'kva74ev',btdt rely cellphone hotspot service backup cox days cox get unreliable whether outages jitter post https get tech look service thats usually far better phone support
'kvabh20',use separate name password checkbox grey pod use primary user id
'kvacct5',grey every time check box automatically turn back pod
'kvadha5',check change wifi name passwords save save leave app go back show change
'kvas8o2',smart hub better throw tantrum
'kvb0cvu',oh someone internet angry first day reddit ceo cox hurt feel google spend three hours google try get fix thank incredibly unhelpful input
'kvb0pj7',click immediately turn back anything screen keep shut back maybe glitch something try tomorrow least give hope work
'kvb263t',okay didnt know glitching like would try clear cache uninstalling reinstall app alternative device try well think possibly well site computer tool wifi else fail call tech support able assist change end still access tool tech support
'kvb2bjv',may may help think im big app person next door app see others area problem problem maybe find solution problem somewhere neighborhood node feed area either overload bad amplifier also lot people dont know sometimes youre problems forget call corrode file handle internet cox since mid see last suggestion many many time internet
'kvb4d35',check packet loss run ping test packet per second months ago get around packet loss speed fine internet seem normally online game fps unplayable issue actually fix next day without anything
'kvb5hcg',know try see work thank
'kvb5oaw',spend hours google nothing make learn quicker offer knowledge clearly havent already find topic youre right throw stuff away
'kvb5qzz',appointment get fix boom do
'kvbft1x',mb get plan
'kvbjpll',worry person comment actually helpful want take aggression somebody online make feel better hope better day go forward
'kvbrnk5',user switch important source email icloud great
'kvbt1gt',measure jitter last hour way read jitter describe packet
'kvbttru',ill write anything help second tech come tomorrow use much big deal people like work home huge deal lose almost wag days outage credit give slap face
'kvc0oqz',factory reset way go
'kvc17ei',one reason use cox junk buy modem router
'kvc3l08',might log diagnostic check try password enter factory reset factory reset take minimal effort
'kvcb8lj',password
'kvchg3n',start happen yesterday live keep put call hate deal tech support probably tomorrow learn anything interest post
'kvnkh9l',make add home phone call say could give discount add month home phone need
'kvnmywf',imagine house build isnt already coax coax wall jack inside house coax already terminate box side house thing cox connect house box need come inside test signal
'kvnphkt',would still buy place like home depot low last look builders know use cheaper materials get away sound like replacement probably par others fish wire though probably could isnt rocket science run wire last time need tge cox tech feed wire attic run need
'kvnqlx0',thing note coax could connect satellite provider connect pay tech find get room need
'kvnwpw9',tech charge state pay since say would work online work cox really
'kvnwxch',inside depend need do
'kvo1rhb',ask heck go inside house
'kvo5do8',point op confirm least eye also assume wire instal cox guess could incorrect afaik cox use shield long time long work start go attic depend live temperature attic get quite hot safety issue
'kvo6b33',cox since use sell landline dial way broadband highspeed use never charge unlimited data ever since get rid net neutrality start charge say service provide thats bs company provide less dont charge unlimited data dont care tryin take advantage people use cox area cox get know theyll pay use cox thats also best keep give fake discount soon go leave instead lower price good business practice dont care anything get much theyre customers possible even mean charge price gouge
'kvo7ney',crazy dads company go force move equipment office storage unit back house box paperwork clean equipment sensitive chemicals mess dad super insecure nobody company unfortunately get another storage unit stuff new company start turn profit room house modem worst foot stack box fall many time
'kvoew9e',show
'kvoftfu',lot hotel tvs hospitality mode days lock settings
'kvoi28q',need tech credit could something end oliver chat bot real person
'kvojdjf',may figure case cox email address stay exactly connect yahoo mail servers instead cox sound like use thunderbird follow instructions cox provide settings would change find could send mail couldnt receive solution wasnt mention cox instructions change authentication protocol incoming mail normal password oauth complete setup successfully able access mail cox servers mail include folders move yahoo servers im big fan yahoo move stuff gmail im keep address yahoo catch correspondents may forget update gmail address year probably delete like cox decades yahoo gmail even exist email longer tie cox easily dump cox oec soon get chance actually do big favor answer one question mail move use isp available address still work like always
'kvojuvw',fiber cox coax cox charge pro install years run situations custom customer charge
'kvok1lh',cool verizon plan long time still use coax cable
'kvomj8v',cant say theyre social media team first launch early even back pretend purpose keep people phone make company look responsive effective online public least use streamline lot normal tech support process recall mesa az use ahead curve term internet speed reliability little jealous get meg download speed area wouldnt happen systematic infrastructure problems likely problem isolate fairly small area least coxhelp probably find whats really go
'kvon1ri',say work hard ettr keep slip cox never tell rca outages part get crank though try enable text notifications alert service supposedly restore website throw error try call tech support error ivr recognize number say aware outage affect area nobody could talk could fix faster hang
'kvorj27',month ago requirement need set delay disconnect call number days later get approve discount would say call get agent question ask
'kvowo02',sure know thing
'kvoxsw3',know verizon coax maybe twist pair anyway two different company work cox years
'kvpv2ob',post rant weekly rant stick thank
'kvqpxx1',devices issue connect ps
'kvqqxvb',wag try use google dns manual dns see https instructions
'kvr3mk3',want house wire dont want come house use common sense sound correct
'kvr3ud2',way seem want house rewire rather live without internet let somebody inside rewire
'kvr6j7w',case helpful anyone heres end today try cox auto response tell queue however hold music stop silence hang try call say hello time soon hear silent line hang even faster sure make use link instead https https thank barefootbam click get reconnected button end sightly less discount keep current plan since mbps pay promotional rate new version however mbps unlimited data plan also go add extra service new service sign list promotional plan call cox general customer service clarify say new promotion today minus months promotional plan id still love switch cheaper option like verizon since rent cox option seem like pretty decent solution im glad set months hope rest yall success thank much everyone list super helpful solutions comment appreciate yall
'kvr8yip',didnt know cox sell something im loop
'kvr92q5',guess coz verizon isps support address
'kvrcgem',fiber centurylink fiber fiber literally anything cox theyre awful
'kvrd66q',call exactly right apparently amplifier split cable home phone home cable home internet root cause issue tech find outside remove blaze
'kvrecff',retire one field electrician wire many home could care less home job look good dressers medicine cabinet
'kvreqmv',dads really worry know tech care also think part anxiety come danger stuff room modem stay chemicals acids knock could harm mix could kill
'kvrf7fu',care sense profit customer experience hence probably millions spend try convince people phone internet bad instead use money upgrade infrastructure compete big bad phone internet
'kvrhlbg',still havent receive email notify move yahoo today outlook cant download email
'kvrtn91',tasty stuff shouldnt even home mean home home whoevers home live want personally dont stuff like home put modem different room
'kvrtthy',room coax run outside yes know home use storage unit dads company go
'kvs1de3',weather change effect cable coax go low cause issue get tech get ticket maintenance get check
'kvs20ve',work call weird experience though oddly take literally try get call keep end guy come finally say hello say yes hello realize hes work guess go yes cox help say yeah go cancel service bill go next month offer discount pull account phone number ask pin confirm address put hold come back confirm service tell full price internet data plan cheaper pay never call number never set cancelation date never get email offer seem like may room untrained outsource people fire discount give try dont surprise odd unprofessional experience haha
'kvs5uis',issue device connect ethernet true gig outages etc
'kvs93de',modem get see gig modded unlimited data expensive see
'kvs9x4j',pay highest speed fastest modem etc havent issue since upgrade dont think anything issue cause company perform maintenance area yesterday post app know outage area today also abundance internet service area provide cox offer limit matter look
'kvsdy1e',weeks back notice get really terrible bandwidth time rep actually admit intentionally throttle part sales pitch get unlimited plan logic protection slow would help avoid charge exceed data allotment make much sense say covid infections lower less test discover mislead call previously gigablast promotion end promise could keep exact plan actually reduce bill modest decrease total bandwidth use sound good true every detail find data cap reduce new plan actually mbps convince upgrade mbps promise immediate big improvement jump mbps fast forward month inconsistent mbps morning hours later ive reach mbps suppose right since publish speed pretty much par course days im sure massive influx people area effect question spend money plan unlimited data even shoot reach mbps anyone able verify
'kvsiy97',jot number accidentally hit reply
'kvsmqqa',number hear aid haha
'kvsmtdm',notice lol
'kvtpr4r',stream entertainment like netflix many entertainment platforms game maybe good girlfriend believe perfect fit girlfriend choose wisely pick best price fit need girlfriend brother play game stream plus live stream plan gig know upload small hopefully upload go future best luck
'kvtq64w',area gig cost area plus options unlimited data month
'kvu0iv4',probably sufficient play game mean update take longer download faster plan game say thats difference wait bite hour versus say minutes plan higher speed plan affect ping time substantially unless theres bunch stuff go network simultaneously livestream upload bottleneck also note soon longer fit definition broadband accord recent decision fcc forsee speed upgrade accordingly distant future
'kvu3iv5',fine would go one tier fine
'kvu3x7d',benefit need
'kvu9pd3',still need docsis modem support multigigabit arris good example
'kvud5fz',pretty slow id get least since two id say get
'kvue86k',rep run line test might need tech come
'kvuhlac',want get perspective close henderson nv street vegas thing spotty internet throughout march tell reset modem never much else issue father speak someone get tell order stop spotty internet upgrade house internet cable agree since already battle raise monthly general point pay gb modem arris last month use gb get cable tv bundle increase gb go help situation
'kvukknk',gon na explain idea youve do base message guess youve split ghz wifi theyve get different name wont get gigabit wifi also highly unlikely wire connection take account devices environmental factor
'kvum8ek',think right track wifi fluctuate base many factor
'kvum9jc',connect one call mix letter number use password bottom modem want change something familiar shorter password go cox wifi app edit wifi settings change name password want devices stay wifi one want completely separate connection list split band
'kvvff33',always upgrade speed need sign term agreement get discount go affect ability upgrade since game make sure get unlimited data kid game rest us stream go data limit time add unlimited congrats new apartment
'kvvw7s2',change password router change wifi password people need learn wifi signal isp deliver signal modem modem thing router even though many providers use device modem router device modem receive signal isp pass router distribute network choose whether signal distribute via ethernet cable via wifi
'kvwl3fe',second need tech internet line connect splitters demarc connection cable line come street modem
'kvxbf4e',see couple years least
'kvxitho',damn really say test colorado last year maintenance hop lol
'kvxjgq5',cablelabs headquarter also comcast test lab cox footprint colorado major infrastructure upgrade need may years see
'kvxjnv2',ok make sense oh well thank info
'kvylq1u',work call number tell want setup cancellation date even let setup date cancel gentleman phone give instant discount hopefully good true
'kvz174s',cox trash theyve lie twice price tell unlimited last year sign unlimited agree price internet disconnect multiple time day get packet loss everyday constantly
'kvzcy41',plan
'kvzdnbb',need go inside house youre get around part deny access interior techs simply reschedule gain access would install unless check signal modem meter make sure arent ber mer issue channel want tech make sure good signal reliable service
'kvzemji',would complete install ticket unless could verify signal modem exceptions take serious thats dont tech go behind make corrections make time install good technician want make sure line clean signal error free really want skip step find issue couldve handle original ticket call waste time another appointment
'kvzf311',rfog radio frequency glass fiber theres fiber mini node somewhere near exterior wall garage likely go coax
'kvzf9rk',also go fiber mini node time use coax
'kvzff6n',use rfog fiber node garage go coax
'kw01bek',sure cox package come modem aka gateway per https probably older docsis wifi gateway like https
'kw03dbo',recommend buy non cox modem
'kw03q0c',budget allow pay time downside less support
'kw056pi',order options cox provide panoramic wifi gateway free years bring modem additional fee later dont remember choose one say followup email send
'kw0maxt',cox supply gateway meh imo basic use perfectly fine personally go arris along side router combo work really well although bite pricey side
'kw1wgba',beat fiber specially since dont use cgnat plan
'kw1wnuo',drop fiber noad property per month go cox would make run fiber house coaxial
'kw1xjce',access verizon cellular home internet
'kw1xldp',area
'kw1yngl',reason outages every isp go include allo
'kw1yrvc',cox reddit every year work pay gig
'kw1zsnz',ct
'kw207ur',see verizon avail yeah good options
'kw20l8f',competition area soon look forward ask either match price lose customer
'kw20w7c',honest get outages though bad one today others areas metro area get frequently feel like cox upgrade age infrastructure fast enough leave areas spotty service
'kw21fk1',try back part specific discount program already also think cox try create financial disincentive customers downgrade understand everything read seem point price may incoming new customers
'kw21n0t',model gateway pretty sure swap cox store new one however gateways rat least per https fast wire connections
'kw23nbf',actual store better luck
'kw2465i',constantly raise price reason
'kw26qwz',suck definitely need ask purchase hardware support service speed also verizon option home internet options available via cell tower ive test even game quite surprise minimum would good use renegotiate new service cox might worth leave return new customer
'kw285il',cox suck wish areas fios fiber broadband option instead cox monopoly
'kw28s2d',would options starlink
'kw29etx',pay month internet cox fine
'kw29v4p',current options either cox dsl latter cap whop im pay cox weve get competition come though cox already start react well see things end easier switch providers theyll price competitive switch theyre currently nowhere close
'kw2dqfw',ont
'kw2far3',promotion pay nonpromotional rat nonpromotional rat lock price promotions recommend always call price lock go data cap charge bill go reason educate consumer know price go educate service change company likely initial introductory promotional rate go away
'kw2jpdy',promotional promotion switch mobile carrier start land line add hit data cap pay stupid data cap exist much higher raise price regularly bill go educate consumer question look better educate gladly
'kw2qdql',think definitely really get speed hardwired mind number people get mad dont get speed theyre astonish primarily come node cant tell pay yesterday speed test get say think cox terrible company primarily base around price fact option thats could help get lower rate
'kw31trt',lot providers mainly centurylink cox depend ask bad switch every years keep new member status
'kw32r2h',month thats criminal laws kind extortion bill also high years high though soon alternative providers move area cox slash price indignant cox force haggle call desk operator india get less screw price best advice give tell someone else offer much cheaper service probably switch also get modem
'kw35tux',every isp seem region issue honestly depend youre market socal cox pretty damn good keep plant run tackle outages big problems fast
'kw36i4v',like worth pay see zero reason switch slightly better speed pay
'kw36uv5',wouldnt switch unless bad connectivity latency download pretty much worth download media file video game update upload nicer probably fine unless youre streamer content creator upload things could occasionally get bad multiple people time id downgrade today
'kw3ewu3',know lot people keep cox use decent compare dsl dont like change keep https email offload yahoo cox us employee get service free leave cox switch fios fast could fiber better
'kw3m29u',reliability public wifi see acknowledge problems ppl complain cox try hard like comcast ther hat company usa
'kw3ntcc',actually believe comcast buy cox keep cox certain market word package comcast copy cat
'kw3o6b7',bother bring comment easily provable
'kw3xsa6',area may get whatever get panoramic gateway keep try push say absolutely need service dont use modem recommend either arris speed speed
'kw40kb1',first cox best game town cable another fiber available stay email thats move yahoo viable imho ill switch gmail fiber
'kw48h14',new customer last year total internet outage time hours cancellation new service start
'kw497zg',choice id drop tomorrow ive see sound work area im doubtful hopefully run fiber us
'kw4c74c',definitely throttle contact tell flat would throttle due usage even though use gigablast coonection could support even though pay unlimited add plan less hours later throttle happen contact tell would
'kw4cuc7',speed internet cox alternative would dsl
'kw4h001',cluster outages recently coincide switch panoramic mean internet also tv often phone work home livelihood depend consistent service know last time totally incompetent service associate insist instal panoramic correctly say work month outages start happen finally get supervisor agree install look correct end nevertheless experience drop frequently sometimes reconnects minutes time hours
'kw4kqb0',wish available north las vegas either cox centurylink
'kw4kxe4',im north las vegas option either cox centurylink fiber anywhere around
'kw4l7fl',wish upload speed tier alright upload would nice parent ca fiber home internet unlimited data im extremely jealous
'kw4lxv1',cable cant really compete fiber anyway especially direct fiber home connection
'kw4m6aw',upload imin nlv still even pretty sad speed package
'kw4nd9t',cox offer even basic unlimited wouldnt jump ship instead ive pay want unlimited dont get ding go another pay extra unlimited guy break nothing monopoly verizon show area im do
'kw4poxm',stay cox service verizon use cox choice
'kw4tg3d',competition
'kw4up4o',unsymmetrical upload speed charge data overages even data push rarely see double occurrences system double bill happen cox mediocre best low bar unfortunately without much competition raise bar luckily modems thing cox bash advertisements cheaper tech require unlimited data low cox know cable die sales team internet cell phone focus
'kw51cxn',buffer still occur even connect ethernet feel thank use wireless connection lag spike constant unavoidable
'kw5dt31',people always tell deal poor service cox offer cuz company available areas sound like already know answer competitors despite desperate attempt get literally fiber come house think want overpay mediocre internet data limit think like waste time every year call threaten cancel wont overcharge even worse already
'kw5i7mr',sure party country cox rock solid outage probably n years allo fiber instal fiber block im go jump ship still cox email say data cap would apply top customers well want data cap anymore plan faster plan greater data cap alternatively cox could offer data cap increase year customer somehow think go
'kw5m74j',depend coax
'kw5sse9',cox cox privately own company
'kw5t6ki',cox anxiously await frontier become available sometime year
'kw5x0w4',options satellite satellite somehow worse cox
